{
  "$schema": "https://json-schema.org/draft/2020-12/schema",
  "$id": "https://recognizer.dev/schema/findings.schema.json",
  "title": "Recognizer findings",
  "type": "object",
  "additionalProperties": false,
  "required": ["findings_version", "sensor", "commit", "modified", "settings", "findings"],
  "properties": {
    "findings_version": { "const": 1 },
    "sensor": {
      "type": "object",
      "additionalProperties": false,
      "required": ["name", "version"],
      "properties": {
        "name": { "type": "string", "pattern": "^[a-z0-9][a-z0-9_-]*$", "maxLength": 64 },
        "version": { "type": "string", "minLength": 1 }
      }
    },
    "commit": { "type": "string", "minLength": 1 },
    "modified": { "type": "boolean" },
    "settings": { "type": "object" },
    "findings": {
      "type": "array",
      "items": {
        "type": "object",
        "additionalProperties": false,
        "required": ["id", "kind", "severity", "principle", "summary", "evidence"],
        "properties": {
          "id": { "type": "string", "minLength": 1 },
          "kind": { "type": "string", "minLength": 1 },
          "severity": { "enum": ["violation", "warning"] },
          "principle": { "type": "string", "minLength": 1 },
          "summary": { "type": "string", "minLength": 1 },
          "fix_pattern": { "type": "string", "minLength": 1 },
          "evidence": {
            "type": "object",
            "additionalProperties": false,
            "required": ["modules"],
            "properties": {
              "modules": { "type": "array", "items": { "type": "string", "minLength": 1 } },
              "edges": {
                "type": "array",
                "items": {
                  "type": "object",
                  "required": ["from", "to"],
                  "properties": {
                    "from": { "type": "string", "minLength": 1 },
                    "to": { "type": "string", "minLength": 1 },
                    "kind": { "type": "string", "minLength": 1 },
                    "lines": { "type": "array", "items": { "type": "integer", "minimum": 1 } },
                    "rules": { "type": "array", "items": { "type": "object" } }
                  }
                }
              },
              "members": {
                "type": "array",
                "items": {
                  "type": "object",
                  "additionalProperties": false,
                  "required": ["module", "name"],
                  "properties": {
                    "module": { "type": "string", "minLength": 1 },
                    "name": { "type": "string", "minLength": 1 }
                  }
                }
              },
              "measures": { "type": "object", "additionalProperties": { "type": "number" } }
            }
          }
        }
      }
    }
  }
}
